{
  "id": "saying_a_camp_is_a_pause",
  "type": "saying",
  "name": "A pause between two horizons",
  "text": "A camp is only a pause between two horizons.",
  "attribution": "Sea-Drifters' saying",
  "carried_by": "sea_drifters",
  "occasions": [
    "fireside"
  ],
  "epochs": [
    "epoch_post_cataclysm"
  ],
  "canon": "primary",
  "sources": [
    "the owner's draft of nomadic-migration sayings for the cutscenes, 2026-10-01"
  ],
  "notes": "Carried by the sea drifters since 2 October 2026: the owner asked for the fictional sayings to belong to the lore's various peoples, not all to the Vedda."
}
